id,source,ticker,direction,target,outcome,source_verbatim_quote,context,human_verdict
633135,x,TIA,bullish,,pending,#TIA $TIA LONG TRADE ENTRY: 0.401 TARGET: 0.431 STOPLOSS: 0.3902 https://t.co/YQi26NapRl,@learnernoearner: #TIA $TIA LONG TRADE ENTRY: 0.401 TARGET: 0.431 STOPLOSS: 0.3902 https://t.co/YQi26NapRl,
630544,x,NVDA,bullish,222.0,pending,,@onlytrades365: $NVDA 217c 6/10 filled at 4.40 - PT 222/224/230 $SPY $SPX $QQQ,
628712,youtube,WY,bullish,,pending,you're going to make a heck of a lot of money. And that is essentially what Wirehouser does for you in a public form.,,
634308,x,SOL,bullish,117.0,pending,"$98 is the level that could signal a bullish breakout for Solana. Since February, $SOL has been moving within a well-defined channel. I’ve identified the boundaries at $78 (Floor) and $98 (Ceiling), with $88 as the current pivot point. We recently tested that $98 resistance, which resulted in a quick rejection. Now, I am seeing Solana bounce. This suggests we could be gearing up for another retest of the channel top to determine if a breakout is finally in the cards. If we get a daily close above $98, I expect a surge toward $107, with a secondary target at $117. However, If $98 continues to hold as heavy resistance, we could see a retracement back to the $88 mid-range or even a full reset at the $78 floor.","@alicharts: $98 is the level that could signal a bullish breakout for Solana. Since February, $SOL has been moving within a well-defined channel. I’ve identified the boundaries at $78 (Floor) and $98 (Ceiling), with $88 as the current pivot point. We recently tested that $98 resistance, which resulted in a qu",
611466,youtube,RVLV,bullish,,pending,"Revolve, great CEOs at that particular company. They've done a phenomenal job running the business over the years. They got through all these storms, and like they emerged on the other side stronger than ever. If it runs, it's going to run huge.",,
614086,youtube,TLT,bullish,,pending,"We're forecasting the yield curve to steepen. So, we are looking for long-term rates to decline over time, but to decline at a slower rate than short-term rates.",,
626220,youtube,HNST,bullish,,pending,I have them going 750 plus over the next 3 years. I think Honest is the most disrespected super small cap,,
627375,youtube,ACHR,bullish,,pending,I personally think that this is a $15 stock in 12 months,,
632943,x,BTC,bullish,,pending,$100-$1000 challenge (Trade 39) $BTC LONG Take profit: $73500 SL: $69500 Keep your notifications on for next update https://t.co/l5T31zkNFZ,@teamsniperpaji: $100-$1000 challenge (Trade 39) $BTC LONG Take profit: $73500 SL: $69500 Keep your notifications on for next update https://t.co/l5T31zkNFZ,
633559,x,BTC,bearish,,pending,"$BTC hits $66,000 and RSI reaches 21 on the daily chart. 👀 It's oversold but can remain that way. Saylor said he would never sell, then he sold. Capitulation. https://t.co/39zDDNUAbY","@jesseolson: $BTC hits $66,000 and RSI reaches 21 on the daily chart. 👀 It's oversold but can remain that way. Saylor said he would never sell, then he sold. Capitulation. https://t.co/39zDDNUAbY",
609258,youtube,V,neutral,335.0,pending,"And then we have two stocks that in my view go hand in hand, Visa and Mastercard. The famed duopoly of the payment processing business. Visa is at $350.7. Mastercard at $51.87. My buy price for Visa is at $335.",,
605883,youtube,NFLX,neutral,,pending,"Now, Netflix, we talked about in the past that this stock was the first out of the downtrend. This was after the 2022 drop. This was the first stock out of that downtrend. And this was the first fang stock to reverse from the highs. It made its highs back in July and really hasn't recovered those. In fact, it hasn't recovered those. It's made a steady series of lower highs and lower lows. However, it converged, which I don't have on here with the 200 day moving average. I just slapped it on there. It's this dark blue line. It bounced off there and then we had the news today of potentially making a bid on Warner Brothers. This one's going to bounce around and trade on that news. But if it can hold this level in like a thousand bucks, I know we've got a stock split I think coming with Netflix. It might even come as soon as next week. So after the split, anywhere in that $100, even as low as like maybe like 80 $8590, that's good enough. If you can hold that level with Netflix, you have a good shot at resuming this uptrend.",,
633398,x,DEGEN,bullish,,pending,Degen looks very Bullish Daily frame me achha breakout hua hai Thodi correction aani chahiye then 0.002$ ki range tak jana chahiye price $DEGEN ka. https://t.co/2qEhE0ZttC,@globalrashid007: Degen looks very Bullish Daily frame me achha breakout hua hai Thodi correction aani chahiye then 0.002$ ki range tak jana chahiye price $DEGEN ka. https://t.co/2qEhE0ZttC,
633086,x,ACHR,bullish,,pending,"Just on spot, we’re now up +18% since we entered $ACHR. Told you this was my gift to you. https://t.co/2ch3rBDH3r","@han_akamatsu: Just on spot, we’re now up +18% since we entered $ACHR. Told you this was my gift to you. https://t.co/2ch3rBDH3r",
634850,x,WTI,bearish,,pending,"I’ve honestly been following the US-Iran headlines almost every day lately because the oil market has been reacting to every small update extremely fast. Now VP JD Vance confirming that a tentative deal was reached between the US and Iran feels like a major turning point for traders watching $WTI. From what’s being discussed so far: • The Strait of Hormuz could reopen • Partial sanctions may get eased • A 60-day truce for nuclear talks could begin But according to Vance, a few wording issues still remain, and the final approval reportedly depends on Trump. What makes this interesting is how quickly sentiment changed: • Earlier this week, oil dumped after optimism around negotiations. • Then military escalation pushed oil back higher again • Now traders are trying to price in whether this deal actually survives Personally, my oil outlook is becoming slightly more bearish IF the agreement gets finalized because supply fears would likely cool down quickly. But if negotiations suddenly fail again, I still think oil could reclaim strong bullish momentum fast due to renewed Hormuz risks. That’s why I’m still watching $WTI closely on Bitget this weekend.",@orlandopirate01: I’ve honestly been following the US-Iran headlines almost every day lately because the oil market has been reacting to every small update extremely fast. Now VP JD Vance confirming that a tentative deal was reached between the US and Iran feels like a major turning point for traders watching $WTI.,
614130,youtube,TLT,bullish,,miss,Morning Star's economics team and market watchers are predicting the Federal Reserve will lower rates more than once in the final months of 2025.,,
624642,youtube,TSLA,bearish,,pending,"Yeah, cuz you asked about you know, when do you just file bankruptcy? Well, you you sell everything including the house to avoid a bankruptcy. You know, even cash I I don't want you to right now cuz we don't have enough time to dig into the numbers of like a 401k. You do all of that to avoid a bankruptcy, but uh The IRS goes to the top. That's the first thing on your debt snowball right now is those back taxes.",,
631994,x,JCT,bearish,,pending,⚡️⚡️ $JCT/USDT ⚡️⚡️ Signal Type: Regular (#Short) Leverage: Cross (20х) Entry Targets: 0.006579 #Take_Profit #Targets: 1) 0.00648 2) 0.00641 3) 0.00635 4) 0.00625 5) 0.00618 6) 0.00609 7) 🚀🚀🚀 Stop Targets: 5-10% https://t.co/3Y9P5cq29x,@customized_fix: ⚡️⚡️ $JCT/USDT ⚡️⚡️ Signal Type: Regular (#Short) Leverage: Cross (20х) Entry Targets: 0.006579 #Take_Profit #Targets: 1) 0.00648 2) 0.00641 3) 0.00635 4) 0.00625 5) 0.00618 6) 0.00609 7) 🚀🚀🚀 Stop Targets: 5-10% https://t.co/3Y9P5cq29x,
633724,x,SOL,bearish,,pending,🟢Short $SOL WITH ME GUYSS ⚡️Entry: now 💊DCA: 91.75 ❌ SL: 94.601 💵TP: - 87.45 - 86.1 - 84.8 https://t.co/RRhnGUPZiW,@powell_signal: 🟢Short $SOL WITH ME GUYSS ⚡️Entry: now 💊DCA: 91.75 ❌ SL: 94.601 💵TP: - 87.45 - 86.1 - 84.8 https://t.co/RRhnGUPZiW,
615083,youtube,FUBO,bullish,,miss,"Fubo is about to be the big time. You know why? Because we got, you know, we're about to go into July here in just a bit. July and August are the summer months that we're leading up to football season, right? September, October, November, December, huge months for Fubo.",,
611830,youtube,MSOS,bullish,,pending,"So we want to consider sustainability because until you have federal legalization, these companies need to survive at the minimum, right? And look here, 65% of the market cap in that ETF would consist of three names. So those are names certainly we'd want to have exposure to.",,
614170,youtube,SMCI,bearish,,hit,you have a huge investment in inventories and receivables and so that turns into a question of like okay is you know is their actual Revenue going out you know or is excuse me is there actual you know customer cash coming in from their customers or they saying hey this was revenue and it wasn't actually now so so that alone you know I would say puts this um you know in a situation where this is now the the too hard pile for me personally,,
635058,x,SQD,bullish,,pending,"⬆️ Massive Buy-Side Volume on $SQD at 41.0x - With the 41.0x volume surge and a +7.7% jump, combined with bullish signals across all momentum and trend indicators, I expect the price to RISE further in the short term. - The most likely scenario is a brief consolidation or shallow pullback, followed by another push higher, probably toward 0.04304 and potentially to 0.04386–0.04443 if momentum persists. - Example trade setup: Wait for a retest of the 0.04192–0.04120 support zone with a bullish candlestick confirmation (such as a pin bar, bullish engulfing, or a clear higher low on the 5m or 1m chart). Enter long if confirmation appears. - Take profit in two stages: first at 0.04304, then let a portion run towards 0.04386–0.04443. - Stop-loss should be set just under the most recent swing low or below the 0.03978 support. - If price closes strongly below 0.04108 (the equilibrium) or 0.03978 (major support), my bullish bias would shift; in that case, expect a liquidation wick toward 0.03884 or even 0.03717, which could be another buy opportunity if strong reversal signs appear. 📝 This is not investment advice, but an educational analysis. Please wait for confirmation signals before entering any trades and manage your risk carefully, especially after such extreme volume moves! 📊 Get detailed free analysis of any coin on any timeframe you want. Try Finora AI - Your Trade Buddy for free → https://t.co/kMPco9Fs6m","@finora_en: ⬆️ Massive Buy-Side Volume on $SQD at 41.0x - With the 41.0x volume surge and a +7.7% jump, combined with bullish signals across all momentum and trend indicators, I expect the price to RISE further in the short term. - The most likely scenario is a brief consolidation or shallow pullback, followe",
634544,x,BTC,bearish,,unresolved,"$BTC entered the weekend-range again. Bitcoin had a nice move towards the H1 swing-high, which is now also the rangehigh for this weekend. We're in weekend liquidity now, so not expecting big moves. Though, I need to be careful saying that, because last weekend we dumped -10%. On average, nothing really happens during the weekend so I'm not actively trading as some may know. Rules in a range are: Rangehigh can trigger longs after the gain or shorts after the sweep + bearish MSB. Vice versa for the rangelow, after a sweep and bullish MSB longs are triggered. And if we really lose the low and show no strength, continuation shorts could be interesting. HTF-trend remains bearish, let's see what next week brings.","@lennaertsnyder: $BTC entered the weekend-range again. Bitcoin had a nice move towards the H1 swing-high, which is now also the rangehigh for this weekend. We're in weekend liquidity now, so not expecting big moves. Though, I need to be careful saying that, because last weekend we dumped -10%. On average, nothin",
612626,youtube,XRP,bullish,,unresolved,"XRP's been suffering. You look at XRP. The 50 EMA is all the way up there at 209. And we are priced at what? 180 185. 186. Yeah, we're at 186 right now. If we can confirm above the 13 EMA, I would think we're going back up to the 50. I'll probably try to play a swing trade.",,
634668,x,OPEN,bullish,,pending,Day 98 of buying 1 share of $OPEN everyday until the price is $82/share. Currently at 2514 shares @ $6.40 avg. https://t.co/W0jMmzOClC,@mralwaysrugged: Day 98 of buying 1 share of $OPEN everyday until the price is $82/share. Currently at 2514 shares @ $6.40 avg. https://t.co/W0jMmzOClC,
611834,youtube,GLD,bullish,,pending,"When we think about risk, we need to be realists. Gold is a flight to safety asset, and alternative assets have historically fared well in times of turmoil.",,
612530,youtube,UUP,bearish,,unresolved,"Now, I'd say what's most shocking about this selloff is not about what's happened in equity markets, which as I say is classic risk off. It's the fact that the dollar has sold off as well. The dollar has not rallied during this selloff. It's weakened significantly against a lot of the other major currencies.",,
633889,x,MU,bullish,1200.0,pending,$MU Entering an area of interest. Could get choppy or potential retracement. Target is 1200 but this area could be rough on longs before it gets up there https://t.co/fnj9aKocsL,@yosaycheese: $MU Entering an area of interest. Could get choppy or potential retracement. Target is 1200 but this area could be rough on longs before it gets up there https://t.co/fnj9aKocsL,
611543,youtube,UUP,bullish,,pending,"raising interest rates generally strengthens the dollar. And that's why gold investors are saying, if the Federal Reserve Bank has to raise interest rates, that means reducing the amount of dollars out there, which ultimately strengthens the dollar.",,
630917,youtube,SMR,bearish,,pending,we're not really seeing uh how this firm can Thrive and this just spells it out so take a look at their revenues there and their cost of revenues first of all when you have cogs that's close to revenues that's not good because it means that you're not able to provide a product or service at a profit and here you could see revenues on the decline over time and that's rather alarming and in the most recent article I found talking about new scale it said that their net losses continue to mount,,
628487,youtube,CPB,bullish,,pending,"I highlighted packaged foods names like General Mills, GIS, and the Campbell Company CPB last week as solid long-term safety plays.",,
632901,x,FIVN,bullish,,pending,$FIVN putting this on your radar. 👀 Expecting a wave 1 top soon. Wave 2 is the buy. Wave 3 target: +112% 🚀 It really is that simple. https://t.co/JcuP6ZQ1SF,@echoanalysis: $FIVN putting this on your radar. 👀 Expecting a wave 1 top soon. Wave 2 is the buy. Wave 3 target: +112% 🚀 It really is that simple. https://t.co/JcuP6ZQ1SF,
