id,source,ticker,direction,target,outcome,source_verbatim_quote,context,human_verdict
632700,x,LAB,bullish,30.0,pending,"right now, $LAB has a $7B market cap and a $15B FDV. if #LAB goes up to $30, which is my liquidation price, that would mean its market cap reaches $14B and its FDV hits $30B, surpassing solana. holy shit. https://t.co/g7Xxd62Ne6 https://t.co/kmxKdIuqDu","@maxpot216: right now, $LAB has a $7B market cap and a $15B FDV. if #LAB goes up to $30, which is my liquidation price, that would mean its market cap reaches $14B and its FDV hits $30B, surpassing solana. holy shit. https://t.co/g7Xxd62Ne6 https://t.co/kmxKdIuqDu",
630568,x,MGNI,bullish,20.0,pending,,@marcjacksonla: $MGNI -BTIG initiates Magnite coverage with a Buy rating on CTV growth -Sets $20 target https://t.co/oJD0H0JyQB,
633436,x,AAPL,bullish,308.0,pending,Source Friday trade ideas 5/22 If $AAPL holds 305 → next target 308 If not → no trade If $AMD holds 450 → next target 480 If not → no trade If $SPY holds 743 → next target 747 If not → no trade,@source_options: Source Friday trade ideas 5/22 If $AAPL holds 305 → next target 308 If not → no trade If $AMD holds 450 → next target 480 If not → no trade If $SPY holds 743 → next target 747 If not → no trade,
611293,youtube,SH,bearish,,pending,"We need to make sure that between then and now, we don't end up in a V-shaped recession hole. And that's where the bull bear scale comes in.",,
615914,youtube,MACRO,bullish,,pending,all of a sudden you actually have software that can be sold into more organizations or more departments because the AI will solve the problem that prevented other companies from not being able to deploy it before so right so all of a sudden like I'm I'm a small business and I can have a contract management system because I never would have paid for somebody to go and like review all my contracts but now ai is doing it so I'm in the market of that of that category of software in a way that I wasn,,
616582,youtube,SBUX,bullish,55.0,unresolved,if they grow at just seven percent per year and they have a p of 15 which is low for a company like this the intrinsic value conservatively would be 55. if they grow at 9 and 20 pe then we are at the present value of 79 for a 10 return so maybe just still a little bit expensive to put it into our portfolio let me know when we are at 55 and then it might be very very interesting,,
614534,youtube,SOFI,bullish,,pending,"Would SoFi SoFi benefit from the refi boom? And sure. I mean like like I mean you're asking like two two like we're this is a big ask. Okay. I'm not going to go into upstart right now. We've done Upstart analysis before. Upstart's like a nice referral business for lenders, but yeah, I mean, SoFi, as long as SoFi, as long as there's no recession, SoFi can keep raising money and lending it.",,
608314,youtube,TSLA,bearish,,miss,"I've actually been locking in some profits on Tesla's stock just because like this whole situation, whether whether I agree or disagree with any of it socially, politically, putting all of that aside, the whole situation has just become a bit too volatile and political in my opinion, which is something that I never really like to see in a stock that I own because it can potentially alienate part of your customer b customer base, which in the case of Tesla is also happening happens to be occurring during a very challenging time for them where they not only as a stock hold a very rich valuation forward P ratio is like almost a,000% higher than the sector but they're also facing you know a delivery growth slowdown that has even turned negative in some cases and although um I am still holding much of my position long-term for their future potential and all the technologies that they have and on the impressive work they do. It's still something that I just felt like I need to be locking in some profits here because um it's very hard to predict how some of this stuff is going to play out.",,
625225,youtube,MELI,bullish,,pending,"I see personally at least a double over the next 5 years, maybe even a little bit more",,
611795,youtube,NVDA,bullish,,pending,"Our plan is going to be to continue to get data center hardware exposure from our largest position, which is Nvidia. They're the undisputed leader in a critical data center component, perhaps the most important, right?",,
633767,x,ZAMA,bullish,,pending,🟢LONG $ZAMA WITH ME GUYSS ❌SL: 0.03272 💵TP: 0.03477 - 0.03545 https://t.co/1ZKLI7LsHd,@powell_signal: 🟢LONG $ZAMA WITH ME GUYSS ❌SL: 0.03272 💵TP: 0.03477 - 0.03545 https://t.co/1ZKLI7LsHd,
615683,youtube,META,neutral,,near,"Meta still not ready. Now, this is a level I pointed out last night is from the April low to the all-time high here, we pulled back precisely 61.8%. Now, everyone's been trying to buy the dip in here, and it's been down 1 2 3 4 five. Well, I guess it was up that day, seven out of the last eight days or so, and it got a little bit more volume. That's good to see. Uh, and we saw a better bounce in here today, but still, it's below the declining 5-day moving average. the evidence isn't there that the buyers have taken control.",,
624762,youtube,DIS,bearish,,pending,"Video title: My Divorce Is Costing Me a Fortune ($200k and Counting) Channel: The Ramsey Show Highlights Published: 2026-05-04 Transcript: music] >> Zander shops all the top term insurance companies to save you money. Get started at zander.com. Well, I'm going through a now 3-year divorce and having hard time uh financing the rest of the divorce. We've used up quite a bit of assets during that time. Um so You and your ex-wife Yes. Yeah, Why has it dragged out for 3 years? >> soon to be. Um She h",,
612065,youtube,COIN,bullish,,pending,"I know that you see them no support. Once this passes, depending how it passes, their stock will go higher. crypto. The big seven are the ones I think rally the most.",,
629959,x,RR,bullish,,pending,,@EchoAnalysis: $RR Fear creates opportunity 👀 Price down 30% from the recent highs for subwave 2. Reclaiming the 50DMA would be very bullish. Long term Wave 3 target: 516% 🚀 https://t.co/QQvRN7mv7o,
632777,x,BABA,bullish,117.0,pending,"$BABA at the 200‑week isn’t $MSFT in March. Price sits ~$110 premarket after a -4.7% gap with a DoD “military company” overhang, AI capex noise, and a -26% slide vs its 200‑day. Support exists, but supply is active. Strong take: BUY only on a weekly reclaim > $116–$118; otherwise wait for $103–$106 fills with tight risk. Turn uncertainty into decisions with Incite.","@incite_corp: $BABA at the 200‑week isn’t $MSFT in March. Price sits ~$110 premarket after a -4.7% gap with a DoD “military company” overhang, AI capex noise, and a -26% slide vs its 200‑day. Support exists, but supply is active. Strong take: BUY only on a weekly reclaim > $116–$118; otherwise wait for $103–$1",
612719,youtube,TSLA,bullish,400.0,pending,I've got just shy of 10 million units out 10 years. I'm going to caution you here there's a big if here this whole thing is predicated on a lot of assumptions but the biggest driver here is saying hey car sales are going to go from 1.3 billion annually to 10 billion annual car sales.,,
625296,youtube,TTD,bullish,,delisted,I'm using the opportunity to pick up more shares though on a company I believe is going to be one of the next gen magnificent 7 in the future,,
624665,youtube,NQ,bullish,,pending,ये फंड मैनेजर ना बदल गया है या अब मेरे को फंड का जैसा ऑपरेशन चल रहा है वो पसंद नहीं है मुझे निकलना है तो इन्वेस्टर निकल तो नहीं सकता यानी इन्वेस्टर फंस जाएगा तो ऐसे में मैं नहीं चाहता कि हमारे इन्वेस्टर्स किसी एग्रेसिव या वोलेटाइल फंड में फंस जाए लैक ऑफ एग्जिट ऑप्शन के कारण इसीलिए भी यहां सेफ्टी और स्टेबिलिटी ज्यादा जरूरी है तो प्योर ऑन द बेसिस ऑफ अल्फा इस कैटेगरी को हम नहीं देखना चाहते तो जब आप रिटर्न्स के बेसिस पे प्योर फिल्टर आउट नहीं करना चाहते और ये सेफ्टी ओरिएंटेड फंड्स की तरफ आप जा रहे हो,,
626884,youtube,TSLA,bearish,350.0,unresolved,Freaking Tesla going down.,,
628458,youtube,INTC,bearish,100.0,pending,"I think you can retest the 100 on this move. Maybe even the 50 period on the daily, but that's a long way from here.",,
606694,youtube,TXN,bullish,190.53,hit,but the reality of the market right now is there really aren't a lot of great opportunities as we have seen the market rally quite a bit over the last couple of months but with that being said I still think this company is trading at a decent value long term,,
622261,youtube,MSFT,bullish,,hit,"I like Microsoft. I think it's gotten really highly valued here, but there was some reasons for it because they did have some acceleration in growth.",,
607744,youtube,TSLA,bullish,300.0,hit,thus he maintained his outperform rating with a $300 price Target on the stock so yeah guys those are some very bullish sentiments there,,
635184,x,XOM,bullish,172.0,pending,$XOM -Cowen reiterates Exxon Mobil $172 target Buy - $XPO -Citi raises XPO target to $236 from $221 Neutral - $ZION -Stephens resumes Zions Bancorp coverage at Overweight $79 target --,@marcjacksonla: $XOM -Cowen reiterates Exxon Mobil $172 target Buy - $XPO -Citi raises XPO target to $236 from $221 Neutral - $ZION -Stephens resumes Zions Bancorp coverage at Overweight $79 target --,
627584,youtube,MSFT,bullish,,pending,I got to be adding more of that stock this month,,
609069,youtube,PYPL,bearish,,hit,so right now paypal is a short,,
607334,youtube,MSFT,bullish,,miss,I like the stock even here and I've been a buyer myself,,
614850,youtube,AMD,bullish,,unresolved,"If AMD doesn't go green at the open, it's a bad day. Like, I I I don't think it's an opinion anymore. I think it's a fact.",,
611702,youtube,SPY,bullish,,pending,"Now 2026 is shaping up to be a very abnormal year. It would not surprise me to see 8,500, even maybe 9,000 on the S&P 500.",,
631051,youtube,XOM,bullish,,pending,I really like having energy stocks and Exxon specifically in your portfolio I think it provides a good natural head for you know inflation if that were to come back of course if we were get you know any more or an expansion in geopolitical Conflict you know that could bump up you know oil prices in the short term as well and of course there's a lot of Leverage here if oil prices you know stay high or move up higher you know over the M medium medium term you know as compared to our forecast or if,,
609809,youtube,NOC,bullish,,pending,am i in love this company no but am i putting on a radar absolutely because it's it is selling for probably close to the mid-20s and pe and it's not going to take much for it to drop to a price that makes sense for you,,
608068,youtube,MAA,bullish,,hit,I think 2025 and Beyond is going to look amazing for these companies,,
630781,youtube,COST,bearish,620.0,pending,We think Costco stock is worth $620.,,
606510,youtube,SQ,bearish,20.0,pending,my number is insanely low go ahead paul i'm gonna look at this company thinking to myself twenty dollars a share especially with the dilution i mean it's an insane amount it's gotta drop so much for me to be interested because they're diluted it's super expensive and they're diluting the heck out of everybody that's a problem,,
630493,x,HYPE,bullish,,pending,,@powell_signal: 🟢 LONG $HYPE WITH ME GUYSS ❌SL: 58.2 💸TP: 62.5 - 64.5 - 66.5 https://t.co/UKkSrzMNlJ,
612120,youtube,TLT,bullish,,pending,"By June, I am expecting a rate cut though. And um for multiple reasons, new people in there and everything else.",,
616353,youtube,XLY,bullish,,hit,"In a soft landing scenario, cyclicals like industrials, financials, and discretionary names take the early lead after rate cuts and money rotates from bonds into equities.",,
629469,youtube,TSLA,bearish,,pending,Tesla will be interesting and I probably think it's a better short underneath the entirety of this as overhead supply,,
633050,x,SOFI,bullish,38.0,pending,$SOFI 🚨BREAKING NEWS🚨 Mizuho reiterates $38 price target on SOFI https://t.co/vqJ4VKMzeg,@kylewhitegoat: $SOFI 🚨BREAKING NEWS🚨 Mizuho reiterates $38 price target on SOFI https://t.co/vqJ4VKMzeg,
632816,x,AAPL,bullish,311.0,pending,$AAPL is 1.5% below its 52‑week high with RSI ~72 and Services margin at 75% in my live data. A daily close ≥303.2 unlocks 309–313 quickly; a slip &lt;298.5 delays it. Decision: BUY strength through 303.2; WAIT otherwise.,@incite_corp: $AAPL is 1.5% below its 52‑week high with RSI ~72 and Services margin at 75% in my live data. A daily close ≥303.2 unlocks 309–313 quickly; a slip &lt;298.5 delays it. Decision: BUY strength through 303.2; WAIT otherwise.,
616077,youtube,CRWV,bullish,279.0,pending,"If the forward PE multiple were to come in at 125, the stock price could more than triple to $279 per share by the end of next year.",,
611502,youtube,INTU,bullish,,pending,"Intuitit's got a phenomenal business model, Turboax, so taxes need to always be done. So, it's a strong moat regardless of the economy. They obviously have their QuickBooks product. They have other products as well, but QuickBooks, like if you have a small business, use in it.",,
633769,x,WET,bullish,,pending,🟢LONG $WET WITH ME GUYSS ❌SL: 0.10542 💵TP: 0.11201 - 0.11421 https://t.co/Odk2bh089J,@powell_signal: 🟢LONG $WET WITH ME GUYSS ❌SL: 0.10542 💵TP: 0.11201 - 0.11421 https://t.co/Odk2bh089J,
633520,x,TSLA,bullish,,pending,Another good trading day. I'm mostly holding puts overnight except $TSLA where I have a moderate call position. This week I've held puts but day traded calls effectively. An overnight move up will likely be minimal while an overnight drop could be massive is reasoning for it,@blake33x: Another good trading day. I'm mostly holding puts overnight except $TSLA where I have a moderate call position. This week I've held puts but day traded calls effectively. An overnight move up will likely be minimal while an overnight drop could be massive is reasoning for it,
606706,youtube,USB,bullish,42.79,miss,so when we jump over to the output tab I'll zoom out just a little bit so we can see things better but the three valuations 4659 multiples at 3620 dividend discount model at 44.59 and while the current price attainable Book value doesn't give us a specific intrinsic value we did come to the conclusion that it looked like they were slightly undervalued compared to where they had been historically which stays in line with our intrinsic value when we compare it to the current trading price it looks like there's a difference of around seven percent so it is trading a little bit closer to the current price in these other companies that we've looked at today,,
607205,youtube,ON,bullish,,pending,yes ON Semiconductor has a very fine Outlook through 2027 you can see that their revenue is expected to be 10 to 12% in compound annual growth rate which would be three times their peers in the semiconductor IND industry gross margin operating expenses operating margin capex all expected to improve and they their free cash flows expected to grow to 25 to 30% all this while doing plenty of share BuyBacks they expect to return 50% to shareholders through 2027,,
629956,x,AGEN,bullish,,pending,,@EchoAnalysis: $AGEN Nearing a breakout 👀 Price is pressuring the trendline and wants the breakout. Flipping the 50WMA to support is where I'm interested. Wave 3 target: 208% 🚀 https://t.co/NcLbx2uxUG,
631713,x,JCT,bullish,,pending,"🏋️ $JCT just saw 3.7x buying volume, real demand or trap? - This 3.7x volume anomaly with strong price action and mostly bullish indicators suggests genuine accumulation or an event-driven breakout, which typically precedes further upside. - I expect the price to RISE further in the short term, targeting first 0.007387, followed by 0.007599, and possibly testing the 0.008272 zone if bullish momentum continues. - For a trade, I would look for a slight cooldown or retest of the 0.006890-0.006793 area. A clear sign of rejection or reversal here—like a pin bar or bullish engulfing candle—would be my green light to go long, with targets at 0.007387 and 0.007599. Always put your stop-loss below the recent swing low so you’re protected if the trend reverses. - If, however, price loses 0.006701 and closes below 0.006482 with strong selling, I would abandon longs and watch for a possible deeper retracement towards 0.005605. - Remember: don’t chase the move after a spike—wait for price to settle and show you clear confirmation that buyers are still in control. If you see another strong bullish candle off support or a liquidity sweep (where price dips below a recent low and quickly reverses), these are classic smart money entry signals. 📝 This is not investment advice, just an educational report. Always manage your risk and wait for confirmation before entering any trade! 🚦 📊 Get detailed free analysis of any coin on any timeframe you want. Try Finora AI - Your Trade Buddy for free → https://t.co/kMPco9Fs6m","@finora_en: 🏋️ $JCT just saw 3.7x buying volume, real demand or trap? - This 3.7x volume anomaly with strong price action and mostly bullish indicators suggests genuine accumulation or an event-driven breakout, which typically precedes further upside. - I expect the price to RISE further in the short term, t",
632876,x,SLDP,bullish,,pending,"$SLDP no concerns. 👀 Price down 8% yesterday, pulling back closer to the 50DMA on lower volume. Support there is another opportunity to add. If price falls below and rejects then I will be cautious. Wave 3 target: +360% 🚀 https://t.co/Gdrj8tw9vJ","@echoanalysis: $SLDP no concerns. 👀 Price down 8% yesterday, pulling back closer to the 50DMA on lower volume. Support there is another opportunity to add. If price falls below and rejects then I will be cautious. Wave 3 target: +360% 🚀 https://t.co/Gdrj8tw9vJ",
634815,x,OSCR,bullish,,pending,$OSCR called sub-75 MLR as the re-rating trigger the night before earnings 🎯 70.5% MLR. 3.2M members up 56%. $679M net profit. Highest in company history. Still at 0.3x sales Best ceo in healthcare CEO targeting $45 to $55 by eoy This is just the start 💪🚀 https://t.co/W3daj6uNlr,@thestockup_: $OSCR called sub-75 MLR as the re-rating trigger the night before earnings 🎯 70.5% MLR. 3.2M members up 56%. $679M net profit. Highest in company history. Still at 0.3x sales Best ceo in healthcare CEO targeting $45 to $55 by eoy This is just the start 💪🚀 https://t.co/W3daj6uNlr,
611758,youtube,SPY,bearish,,miss,elevated risk of a market bubble in the stock market right now,,
614000,youtube,MSFT,bullish,,miss,Microsoft we talked about two weeks ago on the program that was your buying opportunity because here you are in this uptrend we said there was two Fang stocks that you could buy Microsoft was one of them because you were touching the bottom of the channel since then it has acted about how you'd expect in this technical pattern you've moved higher and it looks like you're on the verge of creating a new higher high maybe as early as next week,,
632264,x,ROBO,bullish,,pending,"$ROBO is knocking on the door of a major breakout. 🤖🚀 CMP: $0.02115 🎯 Target 1: $0.02180 (PDH) 🎯 Target 2: $0.02285 (premium supply zone) 🛡️ Support: $0.02058 (PWH) Liquidity has been swept, structure flipped bullish, and buyers are defending the weekly high. 👀 A clean reclaim above $0.02180 could send #ROBO straight into the premium zone. The robots are waking up. ⚡🤖 @FabricFND","@third_eye_000: $ROBO is knocking on the door of a major breakout. 🤖🚀 CMP: $0.02115 🎯 Target 1: $0.02180 (PDH) 🎯 Target 2: $0.02285 (premium supply zone) 🛡️ Support: $0.02058 (PWH) Liquidity has been swept, structure flipped bullish, and buyers are defending the weekly high. 👀 A clean reclaim above $0.02180 c",
631149,x,RXRX,bullish,3.5,pending,,"@han_akamatsu: $RXRX Setting up a nice falling wedge on the 1W timeframe, with stock now above the 1W HMA. If we hold this $3 level here, and stock starts grinding towards the $3.5 level breaking out of this wedge, stock can produce something really good going forward. Pretty nice setup worth having an eye on h",
609784,youtube,BIG,bullish,,pending,i said gary i really like this company what am i missing his comment was paul would you be surprised if big lots wasn't around in five years because i would not be so i'm not investing and me being the person that did exactly what everybody else does out there like okay gary's better than me investing i'm gonna listen to him seventy dollars a share now the reason i bring that up is i was looking at going i believed in big lots i believe they would have been around in five years,,
633475,x,NVDA,bullish,,pending,Sold all my may 8/may15 $NVDA calls that I bought yesterday. After 6 down days and hitting mid bolinger it it was a good r/r to play some short terms for a pop. Added June calls. Like this above 220 so will be adding on drops to support levels and trying to actively trade it,@blake33x: Sold all my may 8/may15 $NVDA calls that I bought yesterday. After 6 down days and hitting mid bolinger it it was a good r/r to play some short terms for a pop. Added June calls. Like this above 220 so will be adding on drops to support levels and trying to actively trade it,
605645,youtube,NFLX,bullish,,pending,"I currently hold Netflix in my story fund the gains on it are around $56,000 and it's now moved up to my largest position I continue to hold every share as I still think the future is bright",,
632351,x,NVDA,bullish,,pending,"$NVDA $300 by EOY? $NVDA is moving again. $NVDA is up 18,80% YTD, missing out on the Semi rally. I anticipate $NVDA has 33% upside until EOY. This is not investment advice. https://t.co/O0PqdXzkCG https://t.co/lEBXwjRvv0","@hkistrategies: $NVDA $300 by EOY? $NVDA is moving again. $NVDA is up 18,80% YTD, missing out on the Semi rally. I anticipate $NVDA has 33% upside until EOY. This is not investment advice. https://t.co/O0PqdXzkCG https://t.co/lEBXwjRvv0",
634613,x,BTC,bullish,,pending,"My $BTC Spot Limits Look Like This: Aggressive Scales (60%) 40% at 58,900 20% at 54,565 Moderate Scale (15%) 15% at 49,050 Max Discount Scales (25%) 12% at 41,553 13% at 37,638 The Swing Short acts as a hedge while I accumulate Spot. I’ll be taking profits on it once we start getting confirmations of a Bear Market Bottom.","@mingarithm: My $BTC Spot Limits Look Like This: Aggressive Scales (60%) 40% at 58,900 20% at 54,565 Moderate Scale (15%) 15% at 49,050 Max Discount Scales (25%) 12% at 41,553 13% at 37,638 The Swing Short acts as a hedge while I accumulate Spot. I’ll be taking profits on it once we start getting confirmatio",
614711,youtube,DB,bearish,,unresolved,Are you still short Deutsche Bank? Still short Deutsche Bank. Three years I'm three years in running. The problem Deutsche Bank now suffers from is they're trying to shrink themselves to profitability and that's impossible. They're gonna shrink and then they're gonna become less profitable. I think the stock goes even lower.,,
612670,youtube,QQQ,bearish,586.0,unresolved,"If we dip down and we cross over the 586 on the weekly candle over the next month, that's huge bad. And I do think we'd go back down to the 50 EMA. The below is 586. That's what we're watching for there.",,
634857,x,BTC,bullish,,pending,"This is starting to look a bit absurd. Funding on $BTC has turned heavily negative as bears fight hard to defend the $74.5K level. If they fail to hold it, they could trigger a massive squeeze against themselves. For now, their selling pressure is being absorbed. The last time funding looked like this was near the absolute bottom of the range around $60K.","@orlandopirate01: This is starting to look a bit absurd. Funding on $BTC has turned heavily negative as bears fight hard to defend the $74.5K level. If they fail to hold it, they could trigger a massive squeeze against themselves. For now, their selling pressure is being absorbed. The last time funding looked like",
610920,youtube,MTD,bullish,,miss,mtd mettler toledo i'm not too familiar with this company i think they make scales and different devices for laboratories. just a quick glance at the metrics here and literally every single chart on the list is moving in the right direction the revenue ebitda free cash flow net income earnings per share and they're even doing a lot of share buybacks so i can see why terry smith added more to this one,,
611398,youtube,CCL,bullish,,pending,"Number three, I like Carnival Cruise Line. I do like it as a stock overall if we're thinking about for the next 10, 20 years. We know the boomers, they love to go on cruises and there's going to be a lot of cruises to go on over the next many years.",,
624928,youtube,SPY,bullish,,pending,"The return of Kimmel, whether you watch him or not is a is a win for America. It's a win for the First Amendment.",,
611305,youtube,AAPL,bullish,,hit,"Did y'all see the new uh Apple Neo yesterday? Man, that's freaking brilliant by Apple. Oh my gosh. This This was so brilliant. What was it like $499 for this computer? So smart.",,
